{
  "id": "editorial-789012",
  "title": "New Releases This Week",
  "description": "Our pick of the freshest releases this week.",
  "type": "feature",
  "url": "https://uk.7digital.com/editorial/new-releases-this-week",
  "image": "https://artwork-cdn.7static.com/static/img/editorial/789012.jpg"
}